{
  "version": "2026-10-13",
  "status": "draft-for-owner-review",
  "safe_area_schema": {
    "insets": "{type:'insets', top,right,bottom,left, unit:'%'|'px'|'mm'} margins measured in from each edge",
    "box": "{type:'box', width,height, unit, basis:'full_size', anchor:'centre'} live/display area centred in the format, at full (not artwork) scale"
  },
  "packs": [
    {
      "id": "social",
      "name": "Social",
      "formats": [
        {
          "id": "meta-feed-image-4x5",
          "name": "Meta feed image 4:5 (Facebook / Instagram)",
          "kind": "image",
          "width": 1440,
          "height": 1800,
          "unit": "px",
          "ratio": "4:5",
          "delivery_px": {
            "width": 1440,
            "height": 1800
          },
          "source": "https://www.facebook.com/business/ads-guide/update/image/instagram-feed",
          "notes": "Meta accepts 1.91:1 to 4:5 (1% tolerance), min width 500 px. No safe zone published for feed.",
          "verified": true
        },
        {
          "id": "meta-feed-image-1x1",
          "name": "Meta feed image 1:1",
          "kind": "image",
          "width": 1440,
          "height": 1440,
          "unit": "px",
          "ratio": "1:1",
          "delivery_px": {
            "width": 1440,
            "height": 1440
          },
          "source": "https://www.facebook.com/business/ads-guide/update/image/instagram-feed",
          "notes": "1:1 sits inside Meta's accepted range; the 1440 px size is derived from Meta's 1440-wide recommendation, not stated on the page.",
          "verified": false
        },
        {
          "id": "meta-feed-video-4x5",
          "name": "Meta feed video 4:5",
          "kind": "video",
          "width": 1440,
          "height": 1800,
          "unit": "px",
          "ratio": "4:5",
          "delivery_px": {
            "width": 1440,
            "height": 1800
          },
          "source": "https://www.facebook.com/business/ads-guide/update/video/facebook-feed",
          "notes": "Meta publishes no feed safe zone; footer (headline/CTA) may not show on mobile Facebook Feed for awareness objectives.",
          "verified": true
        },
        {
          "id": "meta-stories-9x16",
          "name": "Meta Stories 9:16 (Facebook / Instagram)",
          "kind": "video",
          "width": 1440,
          "height": 2560,
          "unit": "px",
          "ratio": "9:16",
          "delivery_px": {
            "width": 1440,
            "height": 2560
          },
          "safe_area": {
            "type": "insets",
            "top": 14,
            "right": 6,
            "bottom": 35,
            "left": 6,
            "unit": "%"
          },
          "source": "https://www.facebook.com/business/ads-guide/update/video/instagram-story",
          "notes": "Keep text/logos out of top 14%, bottom 35%, 6% each side. Same spec applies to still images in Stories.",
          "verified": true
        },
        {
          "id": "meta-reels-9x16",
          "name": "Meta Reels 9:16 (Facebook / Instagram)",
          "kind": "video",
          "width": 1440,
          "height": 2560,
          "unit": "px",
          "ratio": "9:16",
          "delivery_px": {
            "width": 1440,
            "height": 2560
          },
          "safe_area": {
            "type": "insets",
            "top": 14,
            "right": 6,
            "bottom": 35,
            "left": 6,
            "unit": "%"
          },
          "source": "https://www.facebook.com/business/ads-guide/update/video/instagram-reels",
          "notes": "Top 14%, bottom 35% (profile icon and CTA), 6% each side.",
          "verified": true
        },
        {
          "id": "tiktok-infeed-9x16",
          "name": "TikTok In-Feed 9:16",
          "kind": "video",
          "width": 1080,
          "height": 1920,
          "unit": "px",
          "ratio": "9:16",
          "delivery_px": {
            "width": 1080,
            "height": 1920
          },
          "source": "https://ads.tiktok.com/help/article/video-ads-specifications",
          "notes": "TikTok publishes minimums only (540x960); 1080x1920 is the conventional delivery. Also accepts 16:9 (min 960x540) and 1:1 (min 640x640). Safe zone: TikTok publishes downloadable templates only (varies with caption length and anchors); no numeric margins on the page.",
          "verified": false
        },
        {
          "id": "youtube-16x9",
          "name": "YouTube 16:9 (long-form and in-stream)",
          "kind": "video",
          "width": 1920,
          "height": 1080,
          "unit": "px",
          "ratio": "16:9",
          "delivery_px": {
            "width": 1920,
            "height": 1080
          },
          "source": [
            "https://support.google.com/youtube/answer/6375112",
            "https://support.google.com/google-ads/answer/13547298"
          ],
          "notes": "YouTube encode ladder includes 3840x2160 and 2560x1440; ads min 1280x720.",
          "verified": true
        },
        {
          "id": "youtube-shorts-9x16",
          "name": "YouTube Shorts / vertical ad 9:16",
          "kind": "video",
          "width": 1080,
          "height": 1920,
          "unit": "px",
          "ratio": "9:16",
          "delivery_px": {
            "width": 1080,
            "height": 1920
          },
          "source": [
            "https://support.google.com/google-ads/answer/13547298",
            "https://support.google.com/google-ads/answer/16041697"
          ],
          "notes": "Google recommends 9:16 for Shorts; only first 60 s plays in the Shorts feed. Google shows a safe-zone graphic but publishes no numeric margins.",
          "verified": true
        },
        {
          "id": "youtube-1x1",
          "name": "YouTube square 1:1",
          "kind": "video",
          "width": 1080,
          "height": 1080,
          "unit": "px",
          "ratio": "1:1",
          "delivery_px": {
            "width": 1080,
            "height": 1080
          },
          "source": "https://support.google.com/google-ads/answer/13547298",
          "notes": "Google Ads also accepts 4:5 and 2:3 vertical.",
          "verified": true
        },
        {
          "id": "linkedin-image-1.91x1",
          "name": "LinkedIn single image 1.91:1",
          "kind": "image",
          "width": 1200,
          "height": 628,
          "unit": "px",
          "ratio": "1.91:1",
          "delivery_px": {
            "width": 1200,
            "height": 628
          },
          "source": "https://www.linkedin.com/help/lms/answer/a426534",
          "verified": true
        },
        {
          "id": "linkedin-image-1x1",
          "name": "LinkedIn single image 1:1",
          "kind": "image",
          "width": 1200,
          "height": 1200,
          "unit": "px",
          "ratio": "1:1",
          "delivery_px": {
            "width": 1200,
            "height": 1200
          },
          "source": "https://www.linkedin.com/help/lms/answer/a426534",
          "verified": true
        },
        {
          "id": "linkedin-image-4x5",
          "name": "LinkedIn single image 4:5 (mobile only)",
          "kind": "image",
          "width": 720,
          "height": 900,
          "unit": "px",
          "ratio": "4:5",
          "delivery_px": {
            "width": 720,
            "height": 900
          },
          "source": "https://www.linkedin.com/help/lms/answer/a426534",
          "notes": "Vertical assets serve on mobile only.",
          "verified": true
        },
        {
          "id": "linkedin-video-16x9",
          "name": "LinkedIn video 16:9",
          "kind": "video",
          "width": 1920,
          "height": 1080,
          "unit": "px",
          "ratio": "16:9",
          "delivery_px": {
            "width": 1920,
            "height": 1080
          },
          "source": "https://www.linkedin.com/help/lms/answer/a424737",
          "notes": "1200x675 also recommended; max 1920x1080.",
          "verified": true
        },
        {
          "id": "linkedin-video-4x5",
          "name": "LinkedIn video 4:5",
          "kind": "video",
          "width": 720,
          "height": 900,
          "unit": "px",
          "ratio": "4:5",
          "delivery_px": {
            "width": 1080,
            "height": 1350
          },
          "source": "https://www.linkedin.com/help/lms/answer/a424737",
          "notes": "Recommended 720x900, max 1080x1350; delivery_px uses the max.",
          "verified": true
        },
        {
          "id": "linkedin-video-9x16",
          "name": "LinkedIn video 9:16",
          "kind": "video",
          "width": 720,
          "height": 1280,
          "unit": "px",
          "ratio": "9:16",
          "delivery_px": {
            "width": 1080,
            "height": 1920
          },
          "source": "https://www.linkedin.com/help/lms/answer/a424737",
          "notes": "Recommended 720x1280, max 1080x1920; delivery_px uses the max.",
          "verified": true
        },
        {
          "id": "x-video-16x9",
          "name": "X video 16:9",
          "kind": "video",
          "width": 1920,
          "height": 1080,
          "unit": "px",
          "ratio": "16:9",
          "delivery_px": {
            "width": 1920,
            "height": 1080
          },
          "source": "https://help.x.com/en/business-and-advertising/creative-ad-specifications",
          "notes": "Read via search snippet; help.x.com returned 403 to direct fetch.",
          "verified": false
        },
        {
          "id": "x-video-1x1",
          "name": "X video 1:1",
          "kind": "video",
          "width": 1200,
          "height": 1200,
          "unit": "px",
          "ratio": "1:1",
          "delivery_px": {
            "width": 1200,
            "height": 1200
          },